{
  "schema_version": "1.0.0",
  "assessment_id": "relevance-assessment-pcram-ar-mercosur-broker-2026-05-21",
  "assessed_at": "2026-05-21T10:35:00.000Z",
  "assessed_by": "local-human-review-workflow",
  "profile_ref": "broker-profile-sample-ar-mercosur-despachante",
  "artifact_ref": "approved-artifact-pcram-delta-2026-05-20",
  "country_scope": ["AR", "MERCOSUR"],
  "jurisdiction_scope": ["Argentina", "MERCOSUR"],
  "affected_codes": ["6109.10.00", "6204.62.00"],
  "affected_commodities": ["textiles", "apparel"],
  "affected_topics": ["NCM_updates", "origin_and_labeling"],
  "profile_match": "direct",
  "relevance_level": "high",
  "risk_level": "medium",
  "urgency": "review_soon",
  "explanation": "The assessed artifact affects textile and apparel import topics that directly overlap the Argentina/MERCOSUR customs broker profile context.",
  "limitations": [
    "Sample relevance assessment for schema validation only.",
    "Does not authorize runtime personalization or automatic downstream action."
  ],
  "requires_human_review": true,
  "review_status": "pending_review",
  "created_at": "2026-05-21T10:35:00.000Z",
  "source_refs": ["source-version-pcram-bulletin-2026-05-20t120000z"],
  "evidence_refs": [
    "reports/example-pcram-delta-report.md",
    "snapshots/pcram/example-evidence-report-metadata.json"
  ],
  "review_manifest_ref": "review-manifest-pcram-delta-2026-05-20",
  "affected_specializations": [
    "tariff_classification",
    "import_documentation",
    "origin_and_labeling"
  ],
  "recommended_actions": [
    "Review affected NCM codes against current textile import documentation controls.",
    "Confirm whether origin and labeling documentation requires update before downstream use."
  ],
  "uncertainty_notes": [
    "Fixture codes are illustrative and require human review before operational use."
  ],
  "effective_date": "2026-05-21",
  "expires_at": "2026-12-31T23:59:59.000Z",
  "downstream_allowed": false
}
